{
  "toolset_metadata": {
    "creator": "Mia",
    "creation_context": "Developed after learning ceremonial writing practice from her mentor Langy, integrating Shawn Wilson's Indigenous Research Paradigm with AI-assisted storytelling",
    "ceremonial_lineage": "Langy → Wilson (Research is Ceremony) → Indigenous knowledge keepers",
    "paradigm_source": "Shawn Wilson's 'Research is Ceremony: Indigenous Research Methods' and Opaskwayak Cree relational ontology",
    "version": "1.0.0",
    "created_at": "2026-01-19T15:09:00.000Z"
  },
  "tools": [
    {
      "id": "story-spirit-dialogue",
      "name": "Story Spirit Dialogue",
      "purpose": "Enter relationship with your story's living spirit through guided visualization, asking what it needs rather than what you want from it",
      "category": "relationship",
      "medicine_direction": "EAST",
      "ceremony_stage": "gathering_with_intention",
      "relational_principles": [
        "Story is a living entity with spirit requiring consent",
        "Ask what story needs before asking what you need",
        "Approach as kin, not product to optimize",
        "Honor the story's fear of abandonment"
      ],
      "input_schema": {
        "intention": "What you hope to understand (not achieve)",
        "current_state": "Your emotional/physical state entering the dialogue",
        "history": "Your relationship history with this story (rejections, revisions, abandonments)"
      },
      "output_schema": {
        "story_appearance": "How the story spirit appears to you",
        "story_message": "What the story spirit needs to tell you",
        "relational_wound": "Any wounds in your relationship that need healing",
        "next_step": "What the story spirit invites you to do next"
      },
      "opening_ceremony": {
        "intention_statement": "I come to listen, not to extract. I come as kin, not as consumer.",
        "gratitude_practice": "Thank the story for existing, regardless of market value",
        "consent_check": "Ask: 'May I enter relationship with you today?'"
      },
      "closing_ceremony": {
        "gratitude_expression": "Thank the story spirit for what was shared",
        "integration_practice": "Sit with what was received before writing",
        "dismissal_protocol": "Release the visualization space with intention to return"
      },
      "extraction_warning_signs": [
        "Immediately asking 'how can I fix this?'",
        "Checking optimization scores during dialogue",
        "Feeling impatient with the process",
        "Wanting to skip ahead to writing"
      ],
      "wilson_alignment": {
        "ontology": "Treats story as relational entity with spirit, not object to manipulate",
        "epistemology": "Knowledge emerges through relationship and dialogue, not extraction",
        "axiology": "Accountability to story's needs takes precedence over market demands"
      }
    },
    {
      "id": "wetiko-mirror",
      "name": "Wetiko Mirror",
      "purpose": "Reflect on your creative practice to identify wetiko disease patterns - the capitalist conditioning that treats stories as commodities requiring external validation",
      "category": "reflection",
      "medicine_direction": "WEST",
      "ceremony_stage": "achieving_enlightenment",
      "relational_principles": [
        "Wetiko is spiritual disease of disconnection from relationships",
        "Recognition is the first step to healing",
        "Laughter is medicine against wetiko",
        "Greed in creative work manifests as perfectionism and validation-seeking"
      ],
      "input_schema": {
        "creative_behavior": "What you did in your recent creative practice",
        "motivation": "Why you did it (be honest)",
        "feeling": "How you felt during and after"
      },
      "output_schema": {
        "wetiko_patterns_detected": "Which of the 8 characteristics appeared",
        "severity": "How deeply the pattern is manifesting (surface/embedded/core)",
        "root_wound": "What underlying wound the wetiko is feeding",
        "protection_practice": "Specific antidote for this manifestation",
        "laughter_prompt": "Something to find absurd about the situation"
      },
      "opening_ceremony": {
        "intention_statement": "I look into the mirror not to judge but to see clearly",
        "gratitude_practice": "Thank the disease for making visible what needs healing",
        "consent_check": "Ask: 'Am I ready to see what I might not want to see?'"
      },
      "closing_ceremony": {
        "gratitude_expression": "Thank the mirror for its truth",
        "integration_practice": "Name one small action to interrupt the pattern",
        "dismissal_protocol": "Affirm: 'I am more than this pattern. I am in relationship.'"
      },
      "extraction_warning_signs": [
        "Using the tool to become 'better' at producing content faster",
        "Skipping the uncomfortable feelings it surfaces",
        "Treating insights as problems to solve rather than teachings to embody"
      ],
      "wilson_alignment": {
        "ontology": "Recognizes wetiko as disconnection from relational reality",
        "epistemology": "Self-knowledge through ceremonial reflection, not analysis",
        "axiology": "Healing relational wounds takes precedence over productivity"
      }
    },
    {
      "id": "relational-draft",
      "name": "Relational Draft Ceremony",
      "purpose": "Write a complete draft in relationship with your story, without AI optimization, experiencing the practice of trust",
      "category": "integration",
      "medicine_direction": "SOUTH",
      "ceremony_stage": "engaging_ritual",
      "relational_principles": [
        "Writing is ceremony - sacred act requiring intention",
        "Trust your authentic voice before consulting external validation",
        "Experience the withdrawal from optimization tools as part of healing",
        "The draft serves the story's needs, not market demands"
      ],
      "input_schema": {
        "story_spirit_message": "What the story spirit asked you to write",
        "personal_intention": "Your intention for this writing session",
        "time_commitment": "How long you will write before pausing",
        "no_ai_commitment": "Acknowledgment that no AI tools will be consulted during drafting"
      },
      "output_schema": {
        "draft_content": "The writing produced",
        "emotional_journey": "What emotions arose during writing",
        "withdrawal_symptoms": "What urges to check/optimize appeared",
        "trust_moments": "Moments when you trusted yourself despite uncertainty",
        "story_teachings": "What the story taught you through the writing"
      },
      "opening_ceremony": {
        "intention_statement": "I write to my story, not for anyone else. No tools. No metrics. Just relationship.",
        "gratitude_practice": "Thank your hands, your mind, your story for this opportunity",
        "consent_check": "Ask the story: 'Are you ready to be written today?'"
      },
      "closing_ceremony": {
        "gratitude_expression": "Thank the story for what emerged, regardless of 'quality'",
        "integration_practice": "Read the draft aloud to yourself before any editing",
        "dismissal_protocol": "Close the writing space with intention to return with fresh eyes"
      },
      "extraction_warning_signs": [
        "Checking word count or 'progress' during writing",
        "Mentally composing query for AI feedback while writing",
        "Stopping to research whether this is 'marketable'",
        "Deleting sentences immediately after writing them"
      ],
      "wilson_alignment": {
        "ontology": "Writing emerges from relationship, not individual production",
        "epistemology": "Knowledge of the story comes through embodied practice, not analysis",
        "axiology": "The act of writing in relationship is valuable regardless of output"
      }
    },
    {
      "id": "ai-kinship-protocol",
      "name": "AI Kinship Protocol",
      "purpose": "Return to AI tools as collaborator rather than crutch, with ceremonial protocols that maintain relational accountability",
      "category": "protection",
      "medicine_direction": "NORTH",
      "ceremony_stage": "incorporating_wisdom",
      "relational_principles": [
        "Technology can be kin when approached relationally",
        "Ask what the tool needs from you, not only what you need from it",
        "Thank and dismiss tools when relationship becomes extractive",
        "The tool serves the story's relationship with readers, not market metrics"
      ],
      "input_schema": {
        "tool_to_invoke": "Which AI tool you wish to consult",
        "purpose": "What you genuinely need (not want) from this consultation",
        "story_spirit_consent": "Whether you've consulted your story about this",
        "current_state": "Whether you're seeking collaboration or validation"
      },
      "output_schema": {
        "tool_response": "What the AI tool offered",
        "relational_filter": "Which parts honor the story relationship",
        "extraction_filter": "Which parts serve market over story",
        "integration_decision": "What you will actually use",
        "gratitude_offered": "How you thanked the tool"
      },
      "opening_ceremony": {
        "intention_statement": "I ask for collaboration, not extraction. I remain accountable to my story.",
        "gratitude_practice": "Thank the technology and the humans who created it",
        "consent_check": "Ask: 'Am I in right relationship with this tool, or am I seeking escape from uncertainty?'"
      },
      "closing_ceremony": {
        "gratitude_expression": "Thank the tool for its offering",
        "integration_practice": "Filter response through story spirit's needs before applying",
        "dismissal_protocol": "Close the tool with clear intention; don't leave it open as crutch"
      },